{
  "$schemaVersion": "v1",
  "generatedAt": "2026-09-13T04:33:21Z",
  "source": "case-study repoUrl GitHub Actions runs",
  "items": [
    {
      "caseStudySlug": "andreabozzo-site",
      "repoFullName": "AndreaBozzo/AndreaBozzo",
      "repoUrl": "https://github.com/AndreaBozzo/AndreaBozzo",
      "workflowName": "Deploy static content to Pages",
      "workflowPath": ".github/workflows/pages.yml",
      "workflowUrl": "https://github.com/AndreaBozzo/AndreaBozzo/actions/runs/34681378641",
      "runsSampled": 1,
      "medianDurationSeconds": 123,
      "p95DurationSeconds": 123,
      "successRate": 1,
      "latestStatus": "completed",
      "latestConclusion": "success",
      "latestRunAt": "2026-09-12T07:43:20Z"
    },
    {
      "caseStudySlug": "andreabozzo-site",
      "repoFullName": "AndreaBozzo/AndreaBozzo",
      "repoUrl": "https://github.com/AndreaBozzo/AndreaBozzo",
      "workflowName": "GitHub Metrics",
      "workflowPath": ".github/workflows/metrics.yml",
      "workflowUrl": "https://github.com/AndreaBozzo/AndreaBozzo/actions/runs/34736646223",
      "runsSampled": 10,
      "medianDurationSeconds": 179,
      "p95DurationSeconds": 224,
      "successRate": 1,
      "latestStatus": "completed",
      "latestConclusion": "success",
      "latestRunAt": "2026-09-13T03:58:15Z"
    },
    {
      "caseStudySlug": "andreabozzo-site",
      "repoFullName": "AndreaBozzo/AndreaBozzo",
      "repoUrl": "https://github.com/AndreaBozzo/AndreaBozzo",
      "workflowName": "Update External Contributions",
      "workflowPath": ".github/workflows/update-contributions.yml",
      "workflowUrl": "https://github.com/AndreaBozzo/AndreaBozzo/actions/runs/34738140976",
      "runsSampled": 8,
      "medianDurationSeconds": 40,
      "p95DurationSeconds": 406,
      "successRate": 0.875,
      "latestStatus": "in_progress",
      "latestRunAt": "2026-09-13T04:32:48Z"
    },
    {
      "caseStudySlug": "ares-ceres",
      "repoFullName": "AndreaBozzo/Ceres",
      "repoUrl": "https://github.com/AndreaBozzo/Ceres",
      "workflowName": "CI",
      "workflowPath": ".github/workflows/ci.yml",
      "workflowUrl": "https://github.com/AndreaBozzo/Ceres/actions/runs/34560751644",
      "runsSampled": 4,
      "medianDurationSeconds": 376,
      "p95DurationSeconds": 396,
      "successRate": 1,
      "latestStatus": "completed",
      "latestConclusion": "success",
      "latestRunAt": "2026-09-11T04:09:41Z"
    },
    {
      "caseStudySlug": "ares-ceres",
      "repoFullName": "AndreaBozzo/Ceres",
      "repoUrl": "https://github.com/AndreaBozzo/Ceres",
      "workflowName": "Pull Request Labeler",
      "workflowPath": ".github/workflows/labeler.yml",
      "workflowUrl": "https://github.com/AndreaBozzo/Ceres/actions/runs/34560750245",
      "runsSampled": 4,
      "medianDurationSeconds": 10,
      "p95DurationSeconds": 11,
      "successRate": 1,
      "latestStatus": "completed",
      "latestConclusion": "success",
      "latestRunAt": "2026-09-11T04:03:38Z"
    },
    {
      "caseStudySlug": "ares-ceres",
      "repoFullName": "AndreaBozzo/Ceres",
      "repoUrl": "https://github.com/AndreaBozzo/Ceres",
      "workflowName": "Scheduled",
      "workflowPath": "dynamic/github-code-scanning/codeql",
      "workflowUrl": "https://github.com/AndreaBozzo/Ceres/actions/runs/34147401027",
      "runsSampled": 1,
      "medianDurationSeconds": 455,
      "p95DurationSeconds": 455,
      "successRate": 1,
      "latestStatus": "completed",
      "latestConclusion": "success",
      "latestRunAt": "2026-09-07T17:31:01Z"
    },
    {
      "caseStudySlug": "ares-ceres",
      "repoFullName": "AndreaBozzo/Ceres",
      "repoUrl": "https://github.com/AndreaBozzo/Ceres",
      "workflowName": "Scheduled Harvest",
      "workflowPath": ".github/workflows/scheduled-harvest.yml",
      "workflowUrl": "https://github.com/AndreaBozzo/Ceres/actions/runs/34006830621",
      "runsSampled": 1,
      "medianDurationSeconds": 3434,
      "p95DurationSeconds": 3434,
      "successRate": 0,
      "latestStatus": "completed",
      "latestConclusion": "failure",
      "latestRunAt": "2026-09-06T03:31:41Z"
    },
    {
      "caseStudySlug": "ares-ceres",
      "repoFullName": "AndreaBozzo/Ceres",
      "repoUrl": "https://github.com/AndreaBozzo/Ceres",
      "workflowName": "Supabase Keepalive",
      "workflowPath": ".github/workflows/supabase-keepalive.yml",
      "workflowUrl": "https://github.com/AndreaBozzo/Ceres/actions/runs/34686172567",
      "runsSampled": 6,
      "medianDurationSeconds": 13,
      "p95DurationSeconds": 25,
      "successRate": 1,
      "latestStatus": "completed",
      "latestConclusion": "success",
      "latestRunAt": "2026-09-12T09:33:51Z"
    },
    {
      "caseStudySlug": "ares-ceres",
      "repoFullName": "AndreaBozzo/Ceres",
      "repoUrl": "https://github.com/AndreaBozzo/Ceres",
      "workflowName": "npm_and_yarn in /website for astro - Update #1567403918",
      "workflowPath": "dynamic/dependabot/dependabot-updates",
      "workflowUrl": "https://github.com/AndreaBozzo/Ceres/actions/runs/34423493699",
      "runsSampled": 1,
      "medianDurationSeconds": 65,
      "p95DurationSeconds": 65,
      "successRate": 1,
      "latestStatus": "completed",
      "latestConclusion": "success",
      "latestRunAt": "2026-09-10T00:58:46Z"
    },
    {
      "caseStudySlug": "ares-ceres",
      "repoFullName": "AndreaBozzo/Ceres",
      "repoUrl": "https://github.com/AndreaBozzo/Ceres",
      "workflowName": "npm_and_yarn in /website for sharp - Update #1570552858",
      "workflowPath": "dynamic/dependabot/dependabot-updates",
      "workflowUrl": "https://github.com/AndreaBozzo/Ceres/actions/runs/34560685652",
      "runsSampled": 1,
      "medianDurationSeconds": 60,
      "p95DurationSeconds": 60,
      "successRate": 1,
      "latestStatus": "completed",
      "latestConclusion": "success",
      "latestRunAt": "2026-09-11T04:03:28Z"
    },
    {
      "caseStudySlug": "ares-ceres",
      "repoFullName": "AndreaBozzo/Ceres",
      "repoUrl": "https://github.com/AndreaBozzo/Ceres",
      "workflowName": "npm_and_yarn in /website for smol-toml - Update #1570069200",
      "workflowPath": "dynamic/dependabot/dependabot-updates",
      "workflowUrl": "https://github.com/AndreaBozzo/Ceres/actions/runs/34547580947",
      "runsSampled": 1,
      "medianDurationSeconds": 53,
      "p95DurationSeconds": 53,
      "successRate": 1,
      "latestStatus": "completed",
      "latestConclusion": "success",
      "latestRunAt": "2026-09-11T00:42:38Z"
    },
    {
      "caseStudySlug": "ares-ceres",
      "repoFullName": "AndreaBozzo/Ceres",
      "repoUrl": "https://github.com/AndreaBozzo/Ceres",
      "workflowName": "npm_and_yarn in /website for svgo - Update #1565613155",
      "workflowPath": "dynamic/dependabot/dependabot-updates",
      "workflowUrl": "https://github.com/AndreaBozzo/Ceres/actions/runs/34327168909",
      "runsSampled": 1,
      "medianDurationSeconds": 48,
      "p95DurationSeconds": 48,
      "successRate": 1,
      "latestStatus": "completed",
      "latestConclusion": "success",
      "latestRunAt": "2026-09-09T08:05:39Z"
    },
    {
      "caseStudySlug": "datapizza-ai",
      "repoFullName": "datapizza-labs/datapizza-ai",
      "repoUrl": "https://github.com/datapizza-labs/datapizza-ai",
      "workflowName": "Graph Update: pip in /datapizza-ai-clients/datapizza-ai-clients-google, /datapizza-ai-clients/datapizza-ai-clients-openai #1373976480",
      "workflowPath": "dynamic/dependabot/update-graph",
      "workflowUrl": "https://github.com/datapizza-labs/datapizza-ai/actions/runs/26088823839",
      "runsSampled": 1,
      "medianDurationSeconds": 46,
      "p95DurationSeconds": 46,
      "successRate": 1,
      "latestStatus": "completed",
      "latestConclusion": "success",
      "latestRunAt": "2026-05-19T09:34:50Z"
    },
    {
      "caseStudySlug": "datapizza-ai",
      "repoFullName": "datapizza-labs/datapizza-ai",
      "repoUrl": "https://github.com/datapizza-labs/datapizza-ai",
      "workflowName": "Graph Update: pip in /datapizza-ai-core #1373978398",
      "workflowPath": "dynamic/dependabot/update-graph",
      "workflowUrl": "https://github.com/datapizza-labs/datapizza-ai/actions/runs/26088911985",
      "runsSampled": 1,
      "medianDurationSeconds": 57,
      "p95DurationSeconds": 57,
      "successRate": 1,
      "latestStatus": "completed",
      "latestConclusion": "success",
      "latestRunAt": "2026-05-19T09:36:48Z"
    },
    {
      "caseStudySlug": "datapizza-ai",
      "repoFullName": "datapizza-labs/datapizza-ai",
      "repoUrl": "https://github.com/datapizza-labs/datapizza-ai",
      "workflowName": "Test",
      "workflowPath": ".github/workflows/test.yml",
      "workflowUrl": "https://github.com/datapizza-labs/datapizza-ai/actions/runs/32003486877",
      "runsSampled": 16,
      "medianDurationSeconds": 77,
      "p95DurationSeconds": 2592270,
      "successRate": 0.8333333333333334,
      "latestStatus": "completed",
      "latestConclusion": "failure",
      "latestRunAt": "2026-08-30T12:57:21Z"
    },
    {
      "caseStudySlug": "dataprof",
      "repoFullName": "AndreaBozzo/dataprof",
      "repoUrl": "https://github.com/AndreaBozzo/dataprof",
      "workflowName": "Benchmarks",
      "workflowPath": ".github/workflows/benchmarks.yml",
      "workflowUrl": "https://github.com/AndreaBozzo/dataprof/actions/runs/34681463183",
      "runsSampled": 4,
      "medianDurationSeconds": 355,
      "p95DurationSeconds": 432,
      "successRate": 1,
      "latestStatus": "completed",
      "latestConclusion": "success",
      "latestRunAt": "2026-09-12T07:50:31Z"
    },
    {
      "caseStudySlug": "dataprof",
      "repoFullName": "AndreaBozzo/dataprof",
      "repoUrl": "https://github.com/AndreaBozzo/dataprof",
      "workflowName": "CI",
      "workflowPath": ".github/workflows/ci.yml",